{
  "$schema": "http://json-schema.org/draft-07/schema#",
  "additionalProperties": false,
  "definitions": {
    "EvaluationStatus": {
      "description": "How a compiler recommendation affected a planning decision.",
      "oneOf": [
        {
          "description": "The compiler supported the initial decision.",
          "enum": [
            "confirmed"
          ],
          "type": "string"
        },
        {
          "description": "The compiler led to a different decision.",
          "enum": [
            "changed"
          ],
          "type": "string"
        },
        {
          "description": "The compiler identified a missed issue.",
          "enum": [
            "corrected"
          ],
          "type": "string"
        },
        {
          "description": "The compiler identified uncertainty requiring research.",
          "enum": [
            "investigated"
          ],
          "type": "string"
        },
        {
          "description": "The recommendation was unsuitable.",
          "enum": [
            "rejected"
          ],
          "type": "string"
        },
        {
          "description": "There is insufficient evidence to assess value.",
          "enum": [
            "inconclusive"
          ],
          "type": "string"
        }
      ]
    },
    "OutcomeSummary": {
      "additionalProperties": false,
      "description": "A predicted or observed outcome summary, kept distinct by its enclosing event.",
      "properties": {
        "description": {
          "description": "Human-readable expected or observed result.",
          "type": "string"
        },
        "metrics": {
          "additionalProperties": {
            "format": "double",
            "type": "number"
          },
          "default": {},
          "description": "Metric values, keyed by metric name.",
          "type": "object"
        }
      },
      "required": [
        "description"
      ],
      "type": "object"
    },
    "Usefulness": {
      "description": "Whether using a compiler recommendation helped, independent of its [`EvaluationStatus`]: a confirmation can be useless and a change harmful.",
      "oneOf": [
        {
          "description": "Using the recommendation improved the outcome or the decision.",
          "enum": [
            "useful"
          ],
          "type": "string"
        },
        {
          "description": "Using the recommendation made no material difference.",
          "enum": [
            "neutral"
          ],
          "type": "string"
        },
        {
          "description": "Using the recommendation made the outcome worse.",
          "enum": [
            "harmful"
          ],
          "type": "string"
        }
      ]
    }
  },
  "description": "An observed result linked to a prior decision.",
  "properties": {
    "actual_outcome": {
      "allOf": [
        {
          "$ref": "#/definitions/OutcomeSummary"
        }
      ],
      "description": "Measured result, separate from the decision's prediction."
    },
    "capabilities": {
      "default": [],
      "description": "Referenced capability identifiers.",
      "items": {
        "type": "string"
      },
      "type": "array"
    },
    "confidence": {
      "description": "Confidence in the evaluation, when known, in `[0, 1]`.",
      "format": "double",
      "type": [
        "number",
        "null"
      ]
    },
    "decision_id": {
      "description": "ID of the decision this observation evaluates.",
      "type": "string"
    },
    "evaluation_status": {
      "allOf": [
        {
          "$ref": "#/definitions/EvaluationStatus"
        }
      ],
      "description": "How the compiler's recommendation affected the decision."
    },
    "id": {
      "description": "Stable event identifier supplied by the recorder.",
      "type": "string"
    },
    "plan_revision": {
      "description": "Revision of the plan used for the event.",
      "type": "string"
    },
    "schema_version": {
      "description": "Event schema version. PC-02 defines version 1.",
      "format": "uint32",
      "minimum": 0.0,
      "type": "integer"
    },
    "source": {
      "description": "Event producer, such as `pc-cli` or an agent identifier.",
      "type": "string"
    },
    "tasks": {
      "default": [],
      "description": "Referenced task identifiers.",
      "items": {
        "type": "string"
      },
      "type": "array"
    },
    "timestamp": {
      "description": "RFC 3339 event timestamp.",
      "type": "string"
    },
    "usefulness": {
      "anyOf": [
        {
          "$ref": "#/definitions/Usefulness"
        },
        {
          "type": "null"
        }
      ],
      "default": null,
      "description": "Whether using the recommendation helped, assessed independently of `evaluation_status`; absent when not assessed."
    }
  },
  "required": [
    "actual_outcome",
    "decision_id",
    "evaluation_status",
    "id",
    "plan_revision",
    "schema_version",
    "source",
    "timestamp"
  ],
  "title": "OutcomeEvent",
  "type": "object"
}
